{
  "negotiation_id": "neg-bespoke-001",
  "state": "AGREED",
  "selected_bespoke_contract": {
    "kind": "bespoke",
    "purpose_code": "MEDIATION",
    "schema_ref": "vcav_e_mediation_signal_v2",
    "policy_ref": "selkey.default.policy@active",
    "program_ref": "selkey.mediation.program@active",
    "acceptable_model_profiles": []
  },
  "selected_model_profile": {
    "id": "api-claude-sonnet-v1",
    "version": "1",
    "hash": "5f01005dcfe4c95ee52b5f47958b4943134cc97da487b222dd4f936d474f70f8"
  }
}
